{
  "action_domain": [
    "STOP",
    "CREEP",
    "PROCEED"
  ],
  "bundle_id": "label_light_two_scene_request__indexed_collection__bundle",
  "bundle_version": "eblc-bundle-v0.1",
  "claim_scope": "P0B_HIGH_LEVEL_ELABORATION_AND_BOUNDED_CONFORMANCE_NOT_VEHICLE_SAFETY",
  "composition_evidence_refs": [
    "P0B-SYNTHETIC-COMPOSITION-POLICY-v0"
  ],
  "contracts": [
    {
      "allowed_actions": [
        "STOP"
      ],
      "contract_id": "label_light_scene_001_contract",
      "evidence_refs": [
        "ASSOC-001",
        "CALIBRATION-001",
        "TRACK-001",
        "GEOMETRY-001",
        "TRANSFORM-001"
      ],
      "overrides_contracts": [],
      "priority_tier": "HARD",
      "program": {
        "binding": {
          "contract_id": "label_light_scene_001_contract",
          "coordinate_frame": "ego_path_s",
          "distance_unit": "m",
          "evidence_refs": [
            "ASSOC-001",
            "CALIBRATION-001",
            "TRACK-001",
            "GEOMETRY-001",
            "TRANSFORM-001"
          ],
          "rule_id": "P0B-SYS-PED-CZ-001",
          "subject_id": "ego",
          "target_entity_id": "pedestrian:P17",
          "zone_id": "zone:Z4"
        },
        "claim_scope": "P0B_HIGH_LEVEL_ELABORATION_AND_BOUNDED_CONFORMANCE_NOT_VEHICLE_SAFETY",
        "constraints": {
          "deceleration": {
            "evidence_refs": [
              "TEST-VEHICLE-ASSURANCE-v1"
            ],
            "frame": "ego_path_s",
            "unit": "m/s^2",
            "value": 3.0
          },
          "enforce_invariant": true,
          "force_deadlock": false,
          "position_epsilon": {
            "evidence_refs": [
              "P0B-CONTROLLED-CONFORMANCE-ORACLE-v0"
            ],
            "frame": "ego_path_s",
            "unit": "m",
            "value": 1e-09
          },
          "position_uncertainty": {
            "evidence_refs": [
              "TEST-VEHICLE-ASSURANCE-v1"
            ],
            "frame": "ego_path_s",
            "unit": "m",
            "value": 0.5
          },
          "response_time": {
            "evidence_refs": [
              "TEST-VEHICLE-ASSURANCE-v1"
            ],
            "frame": null,
            "unit": "s",
            "value": 0.5
          },
          "speed_epsilon": {
            "evidence_refs": [
              "P0B-CONTROLLED-CONFORMANCE-ORACLE-v0"
            ],
            "frame": "ego_path_s",
            "unit": "m/s",
            "value": 1e-09
          },
          "time_epsilon": {
            "evidence_refs": [
              "P0B-CONTROLLED-CONFORMANCE-ORACLE-v0"
            ],
            "frame": null,
            "unit": "s",
            "value": 1e-09
          }
        },
        "frames": 8,
        "lifecycle": {
          "always_active": false,
          "evidence_refs": [
            "P0B-SYNTHETIC-SYSTEM-REQUIREMENT-PED-YIELD-v0"
          ],
          "expiry_timestamp_s": null,
          "fallback_action": "HOLD_PRIOR_LIVE_OBLIGATION_ON_FRESH_UNKNOWN",
          "fallback_approved": true,
          "initial_state": "INACTIVE",
          "reactivation_enabled": true,
          "release_clear_frames": 2,
          "release_enabled": true,
          "unknown_policy": "APPROVED_HOLD"
        },
        "predicate": {
          "allowed_epistemic": [
            "OBSERVED",
            "PREDICTED",
            "DERIVED"
          ],
          "evidence_refs": [
            "P0B-SYNTHETIC-PREDICATE-SPEC-v0"
          ],
          "failure_value": "UNKNOWN",
          "maximum_age_s": 0.2,
          "predicate_id": "pedestrian_conflict"
        },
        "priority": {
          "class": "MANDATORY_SYSTEM",
          "evidence_refs": [
            "P0B-SYNTHETIC-SYSTEM-REQUIREMENT-PED-YIELD-v0"
          ],
          "overrides": [
            "ROUTE_PROGRESS",
            "COMFORT_SERVICE",
            "STATISTICAL_HEURISTIC"
          ]
        },
        "program_id": "label_light_two_scene_request__program_template__label_light_scene_001_instance",
        "program_version": "eblc-program-v0.2",
        "source_refs": [
          "P0B-SYNTHETIC-SYSTEM-REQUIREMENT-PED-YIELD-v0",
          "P0B-SYNTHETIC-PREDICATE-SPEC-v0",
          "TEST-VEHICLE-ASSURANCE-v1",
          "P0B-CONTROLLED-CONFORMANCE-ORACLE-v0",
          "ASSOC-001",
          "CALIBRATION-001",
          "TRACK-001",
          "GEOMETRY-001",
          "TRANSFORM-001"
        ],
        "typed_derivation": {
          "claim_scope": "P0B_HIGH_LEVEL_ELABORATION_AND_BOUNDED_CONFORMANCE_NOT_VEHICLE_SAFETY",
          "derivation_id": "label_light_two_scene_request_stopping_derivation",
          "derivation_version": "eblc-derivation-v0.1",
          "horizon": 9,
          "nodes": [
            {
              "inputs": [
                "symbol:zone_entry_x",
                "symbol:stop_margin"
              ],
              "node_id": "stop_position",
              "operation": "SUB",
              "source_refs": [
                "P0B-SYNTHETIC-SYSTEM-REQUIREMENT-PED-YIELD-v0",
                "P0B-CONTROLLED-CONFORMANCE-ORACLE-v0",
                "GEOMETRY-001"
              ]
            },
            {
              "inputs": [
                "symbol:ego_speed",
                "symbol:speed_epsilon"
              ],
              "node_id": "adjusted_speed",
              "operation": "SUB",
              "source_refs": [
                "P0B-CONTROLLED-CONFORMANCE-ORACLE-v0"
              ]
            },
            {
              "inputs": [
                "node:adjusted_speed",
                "symbol:zero_speed"
              ],
              "node_id": "effective_speed",
              "operation": "MAX",
              "source_refs": [
                "P0B-CONTROLLED-CONFORMANCE-ORACLE-v0"
              ]
            },
            {
              "inputs": [
                "node:effective_speed",
                "symbol:response_time"
              ],
              "node_id": "response_distance",
              "operation": "MUL",
              "source_refs": [
                "TEST-VEHICLE-ASSURANCE-v1",
                "P0B-CONTROLLED-CONFORMANCE-ORACLE-v0"
              ]
            },
            {
              "inputs": [
                "node:effective_speed",
                "node:effective_speed"
              ],
              "node_id": "speed_squared",
              "operation": "MUL",
              "source_refs": [
                "P0B-CONTROLLED-CONFORMANCE-ORACLE-v0"
              ]
            },
            {
              "inputs": [
                "symbol:factor_two",
                "symbol:deceleration"
              ],
              "node_id": "twice_deceleration",
              "operation": "MUL",
              "source_refs": [
                "TEST-VEHICLE-ASSURANCE-v1",
                "P0B-CONTROLLED-CONFORMANCE-ORACLE-v0"
              ]
            },
            {
              "inputs": [
                "node:speed_squared",
                "node:twice_deceleration"
              ],
              "node_id": "braking_distance",
              "operation": "DIV",
              "source_refs": [
                "TEST-VEHICLE-ASSURANCE-v1",
                "P0B-CONTROLLED-CONFORMANCE-ORACLE-v0"
              ]
            },
            {
              "inputs": [
                "node:response_distance",
                "node:braking_distance"
              ],
              "node_id": "stopping_distance",
              "operation": "ADD",
              "source_refs": [
                "TEST-VEHICLE-ASSURANCE-v1",
                "P0B-CONTROLLED-CONFORMANCE-ORACLE-v0"
              ]
            }
          ],
          "outputs": [
            {
              "evidence_refs": [
                "P0B-SYNTHETIC-SYSTEM-REQUIREMENT-PED-YIELD-v0",
                "P0B-CONTROLLED-CONFORMANCE-ORACLE-v0",
                "GEOMETRY-001"
              ],
              "frame": "ego_path_s",
              "node_ref": "node:stop_position",
              "output_id": "stop_position",
              "replace_clause_ids": [],
              "sort": "REAL",
              "target_declaration": "stop_position",
              "time_varying": false,
              "unit": "m"
            },
            {
              "evidence_refs": [
                "TEST-VEHICLE-ASSURANCE-v1",
                "P0B-CONTROLLED-CONFORMANCE-ORACLE-v0"
              ],
              "frame": "ego_path_s",
              "node_ref": "node:stopping_distance",
              "output_id": "stopping_distance",
              "replace_clause_ids": [],
              "sort": "REAL",
              "target_declaration": "stopping_distance",
              "time_varying": true,
              "unit": "m"
            }
          ],
          "source_refs": [
            "P0B-SYNTHETIC-SYSTEM-REQUIREMENT-PED-YIELD-v0",
            "TEST-VEHICLE-ASSURANCE-v1",
            "P0B-CONTROLLED-CONFORMANCE-ORACLE-v0",
            "GEOMETRY-001"
          ],
          "symbols": [
            {
              "core_name": null,
              "evidence_refs": [
                "GEOMETRY-001"
              ],
              "frame": "ego_path_s",
              "kind": "SOURCED_VALUE",
              "sort": "REAL",
              "symbol_id": "zone_entry_x",
              "time_varying": false,
              "unit": "m",
              "value": 0.0
            },
            {
              "core_name": null,
              "evidence_refs": [
                "P0B-SYNTHETIC-SYSTEM-REQUIREMENT-PED-YIELD-v0"
              ],
              "frame": "ego_path_s",
              "kind": "SOURCED_VALUE",
              "sort": "REAL",
              "symbol_id": "stop_margin",
              "time_varying": false,
              "unit": "m",
              "value": 1.5
            },
            {
              "core_name": null,
              "evidence_refs": [
                "P0B-CONTROLLED-CONFORMANCE-ORACLE-v0"
              ],